title,company name,link
Python Developer,Deloitte,https://www.indeed.com/cmp/Deloitte
Python Developer,Barclays,https://www.indeed.com/cmp/Barclays
"newGeneral Hiring: Software Engineer,TikTok Product Engineering",TikTok,https://www.indeed.com/cmp/Tiktok
newAIA Python Developer (SO 00044892201) (12276387),Kaizen Technologies,https://www.indeed.com/cmp/Kaizen-IT
Python Developer,ING,https://www.indeed.com/cmp/Ing
"Software Engineer, University Grad",Facebook App,https://www.indeed.com/cmp/Meta-dd1502f2
Software Engineers & Web Developers,1DocWay,Link is Not Available
Associate Software Engineer I,ACLU,https://www.indeed.com/cmp/American-Civil-Liberties-Union
"newSoftware Development Engineer (Engineer, Software Developmen...","Canon U.S.A., Inc.","https://www.indeed.com/cmp/Canon-U.s.a.,-Inc."
Junior C++ Developer - Multiple Openings,GTS,Link is Not Available
newSR Python Developer - Software Engineer III,Bank of America,https://www.indeed.com/cmp/Bank-of-America
Telecommuting Software Developer,Rio Software,Link is Not Available
Python Developer - Zinc Team,Bank of America,https://www.indeed.com/cmp/Bank-of-America
Quantitative Analytics Developer AVP,Barclays,https://www.indeed.com/cmp/Barclays
Junior Software Engineer,Alloy,https://www.indeed.com/cmp/Alloy
